{
  "$schema": "https://json-schema.org/draft-07/schema#",
  "$id": "https://github.com/Popoboxxo/agent-meta/agent-meta.schema.json",
  "title": "agent-meta.config.json",
  "description": "Project configuration for agent-meta sync.py. Controls which agents are generated, which models and memory scopes are used, and how hooks and external skills are activated.",
  "type": "object",
  "properties": {
    "$schema": {
      "type": "string",
      "description": "JSON Schema reference — enables IDE autocomplete and validation."
    },
    "_comment": {
      "type": "string",
      "description": "Optional free-text comment, ignored by sync.py."
    },
    "agent-meta-version": {
      "type": "string",
      "description": "The agent-meta version this project was last synced with (e.g. '0.16.5').",
      "pattern": "^\\d+\\.\\d+\\.\\d+$"
    },
    "ai-provider": {
      "type": "string",
      "description": "AI provider (legacy single-value field). Use ai-providers for multi-provider support. Claude enables CLAUDE.md management and settings.json creation.",
      "enum": [
        "Claude",
        "Gemini",
        "Continue",
        "GitHub"
      ]
    },
    "ai-providers": {
      "type": "array",
      "description": "List of AI providers. Supports Claude, Gemini, Continue. Replaces the deprecated ai-provider string field. Backward-compatible: ai-provider (string) still works.",
      "items": {
        "type": "string",
        "enum": [
          "Claude",
          "Gemini",
          "Continue"
        ]
      },
      "uniqueItems": true
    },
    "platforms": {
      "type": "array",
      "description": "Active platform layers. Agents in agents/2-platform/<platform>-*.md override the generic agents.",
      "items": {
        "type": "string"
      },
      "uniqueItems": true
    },
    "roles": {
      "type": "array",
      "description": "Whitelist of roles to generate. If absent, all known roles are generated.",
      "items": {
        "type": "string",
        "enum": [
          "orchestrator",
          "developer",
          "tester",
          "validator",
          "requirements",
          "ideation",
          "documenter",
          "release",
          "docker",
          "meta-feedback",
          "git",
          "agent-meta-manager",
          "feature",
          "agent-meta-scout",
          "security-auditor",
          "openscad-developer"
        ]
      },
      "uniqueItems": true
    },
    "project": {
      "type": "object",
      "description": "Project identity — used in agent filenames and managed blocks.",
      "properties": {
        "name": {
          "type": "string",
          "description": "Full project name (e.g. 'my-plugin')."
        },
        "prefix": {
          "type": "string",
          "description": "Short prefix for extension filenames (e.g. 'mpl' → mpl-developer-ext.md)."
        },
        "short": {
          "type": "string",
          "description": "Short project name for display (e.g. 'my-plugin')."
        }
      },
      "required": [
        "name",
        "prefix",
        "short"
      ],
      "additionalProperties": false
    },
    "variables": {
      "type": "object",
      "description": "Template variables substituted as {{KEY}} in agent templates.",
      "properties": {
        "PROJECT_CONTEXT": {
          "type": "string"
        },
        "PROJECT_GOAL": {
          "type": "string"
        },
        "PROJECT_LANGUAGES": {
          "type": "string"
        },
        "COMMUNICATION_LANGUAGE": {
          "type": "string"
        },
        "USER_INPUT_LANGUAGE": {
          "type": "string"
        },
        "DOCS_LANGUAGE": {
          "type": "string"
        },
        "INTERNAL_DOCS_LANGUAGE": {
          "type": "string"
        },
        "CODE_LANGUAGE": {
          "type": "string"
        },
        "AGENT_META_REPO": {
          "type": "string"
        },
        "GIT_PLATFORM": {
          "type": "string",
          "enum": [
            "GitHub",
            "GitLab",
            "Gitea"
          ]
        },
        "GIT_REMOTE_URL": {
          "type": "string"
        },
        "GIT_MAIN_BRANCH": {
          "type": "string"
        },
        "CODE_CONVENTIONS": {
          "type": "string"
        },
        "ARCHITECTURE": {
          "type": "string"
        },
        "DEV_COMMANDS": {
          "type": "string"
        },
        "BUILD_COMMAND": {
          "type": "string"
        },
        "TEST_COMMAND": {
          "type": "string"
        },
        "EXTRA_DONTS": {
          "type": "string"
        },
        "CODE_QUALITY_RULES": {
          "type": "string"
        },
        "REQ_CATEGORIES": {
          "type": "string"
        },
        "TEST_COMMANDS": {
          "type": "string"
        },
        "TESTER_SNIPPETS_PATH": {
          "type": "string"
        },
        "DEVELOPER_SNIPPETS_PATH": {
          "type": "string"
        },
        "BUILD_COMMANDS": {
          "type": "string"
        },
        "SYSTEM_DEPENDENCIES": {
          "type": "string"
        },
        "SYSTEM_URLS": {
          "type": "string"
        },
        "PRIMARY_PORT": {
          "type": "string"
        },
        "EXTRA_PORTS": {
          "type": "string"
        },
        "SERVICE_NAME": {
          "type": "string"
        },
        "CONTAINER_NAME": {
          "type": "string"
        },
        "PRIMARY_IMAGE_TAG": {
          "type": "string"
        },
        "PLUGIN_DIR_NAME": {
          "type": "string"
        },
        "BUILD_OUTPUT": {
          "type": "string"
        },
        "ARTIFACT_ZIP_CMD": {
          "type": "string"
        },
        "ARTIFACT_TAR_CMD": {
          "type": "string"
        },
        "GH_ASSETS": {
          "type": "string"
        },
        "BUILD_SYSTEM_NOTES": {
          "type": "string"
        },
        "VERSION_DIST_BEHAVIOUR": {
          "type": "string"
        }
      },
      "additionalProperties": {
        "type": "string"
      }
    },
    "model-overrides": {
      "type": "object",
      "description": "Override the default model per role. Precedence: this > roles.config.json > (none).",
      "additionalProperties": {
        "type": "string",
        "anyOf": [
          {
            "enum": [
              "haiku",
              "sonnet",
              "opus"
            ]
          },
          {
            "pattern": "^claude-"
          }
        ]
      }
    },
    "memory-overrides": {
      "type": "object",
      "description": "Override the default memory scope per role. Precedence: this > roles.config.json > (none).",
      "additionalProperties": {
        "type": "string",
        "enum": [
          "project",
          "local",
          "user"
        ]
      }
    },
    "permission-mode-overrides": {
      "type": "object",
      "description": "Override the default permissionMode per role. Precedence: this > roles.config.json > (none).",
      "additionalProperties": {
        "type": "string",
        "enum": [
          "default",
          "acceptEdits",
          "bypassPermissions",
          "plan"
        ]
      }
    },
    "dod-preset": {
      "type": "string",
      "description": "DoD quality profile. Sets defaults for all dod criteria. Individual overrides via 'dod' block. Presets defined in dod-presets.config.json.",
      "enum": [
        "full",
        "standard",
        "rapid-prototyping"
      ],
      "default": "full"
    },
    "dod": {
      "type": "object",
      "description": "Definition of Done — override individual criteria from the preset. Precedence: dod > dod-preset > full.",
      "properties": {
        "req-traceability": {
          "type": "boolean",
          "description": "Require REQ-IDs in REQUIREMENTS.md, REQ-ID in commit messages, traceability audit. Default: true.",
          "default": true
        },
        "tests-required": {
          "type": "boolean",
          "description": "Require tests for every code change, TDD workflow steps. Default: true.",
          "default": true
        },
        "codebase-overview": {
          "type": "boolean",
          "description": "Require CODEBASE_OVERVIEW.md updates after code changes. Default: true.",
          "default": true
        },
        "security-audit": {
          "type": "boolean",
          "description": "Require security audit before release. Default: false.",
          "default": false
        }
      },
      "additionalProperties": false
    },
    "max-parallel-agents": {
      "type": "integer",
      "description": "Maximum number of agents that a coordinator (orchestrator, feature) may run in parallel via run_in_background. Default: 2. Set to 1 to disable parallelism.",
      "minimum": 1,
      "maximum": 5,
      "default": 2
    },
    "speech-mode": {
      "type": "string",
      "description": "Communication style for all agents. Copied as .claude/rules/speech-mode.md — loaded automatically by Claude Code into every agent context. 'full' = default behavior, no rule generated. 'short' = facts only, no filler. 'childish' = playful, simple language with animal/toy analogies. 'caveman' = brutally short, caveman speech.",
      "enum": ["full", "short", "childish", "caveman"],
      "default": "full"
    },
    "hooks": {
      "type": "object",
      "description": "Opt-in hook activation. Scripts are always synced; registration in settings.json requires enabled: true.",
      "additionalProperties": {
        "type": "object",
        "properties": {
          "enabled": {
            "type": "boolean",
            "description": "Register this hook in .claude/settings.json (Two-Gate: script must exist in hooks/ layer)."
          }
        },
        "required": [
          "enabled"
        ],
        "additionalProperties": false
      }
    },
    "provider-options": {
      "type": "object",
      "description": "Provider-specific options. Each key is a provider name (Claude, Gemini, Continue).",
      "properties": {
        "Claude": {
          "type": "object",
          "description": "Options for the Claude provider.",
          "additionalProperties": false,
          "properties": {}
        },
        "Gemini": {
          "type": "object",
          "description": "Options for the Gemini provider.",
          "additionalProperties": false,
          "properties": {}
        },
        "Continue": {
          "type": "object",
          "description": "Options for the Continue provider.",
          "additionalProperties": false,
          "properties": {
            "generate-prompts": {
              "type": "boolean",
              "description": "Generate .continue/prompts/<role>.md as invokable slash-commands. Works with any local LLM — no tool calling required."
            },
            "prompt-mode": {
              "type": "string",
              "description": "Content mode for generated prompts. 'full' = complete agent body. 'slim' = compact role + core rules only (~80 lines).",
              "enum": ["full", "slim"],
              "default": "full"
            }
          }
        }
      },
      "additionalProperties": false
    },
    "external-skills": {
      "type": "object",
      "description": "Opt-in external skill activation. Two-Gate: approved in external-skills.config.json AND enabled here.",
      "additionalProperties": {
        "type": "object",
        "properties": {
          "enabled": {
            "type": "boolean",
            "description": "Generate wrapper agent for this skill."
          }
        },
        "required": [
          "enabled"
        ],
        "additionalProperties": false
      }
    }
  },
  "required": [
    "project"
  ],
  "additionalProperties": true
}
